{
    "$schema": "https://raw.githubusercontent.com/Moonsong-Labs/moonwall/main/packages/types/config_schema.json",
    "defaultTestTimeout": 120000,
    "environments": [
      {
        "connections": [
          {
            "endpoints": ["wss://wss.api.moonbase.moonbeam.network"],
            "name": "ethers",
            "type": "ethers"
          },
          {
            "endpoints": ["wss://wss.api.moonbase.moonbeam.network"],
            "name": "para",
            "rpc": {
              "moon": {
                "isBlockFinalized": {
                  "description": "Just a test method",
                  "params": [
                    {
                      "name": "blockHash",
                      "type": "Hash"
                    }
                  ],
                  "type": "bool"
                }
              }
            },
            "type": "polkadotJs"
          },
          {
            "endpoints": [
              "wss://fro-moon-rpc-1-moonbase-relay-rpc-1.moonbase.ol-infra.network"
            ],
            "name": "relay",
            "type": "polkadotJs"
          },
          {
            "endpoints": ["wss://wss.api.moonbase.moonbeam.network"],
            "name": "viem",
            "type": "viem"
          }
        ],
        "contracts": "contracts/",
        "foundation": {
          "launchSpec": {
            "disableRuntimeVersionCheck": true
          },
          "type": "read_only"
        },
        "multiThreads": false,
        "name": "smoke_tests",
        "reporters": ["basic", "html"],
        "runScripts": ["compile-contracts.ts compile"],
        "testFileDir": ["/suites/smoke"],
        "skipTests": [
            {
                "name": "SC20301",
                "reason": "This test is skipped because it is not ready yet",
                "since": "2024-01-28T00:00:00Z"
            }
        ]
      }
    ],
    "label": "DevOps - Smoke Tests - Default Config",
    "scriptsDir": "scripts/"
  }